{
  "candidate_id": "standalone-runtime-example",
  "candidate_name": "Standalone Runtime Example",
  "promotion_date": "2026-03-23",
  "linked_runtime_record": "runtime/02-records/2026-03-23-standalone-runtime-example-runtime-record.md",
  "target_host": "directive-workspace-standalone-host",
  "target_runtime_surface": "bounded local runtime artifact lifecycle",
  "integration_mode": "reimplement",
  "source_intent_artifact": "runtime/00-follow-up/2026-03-23-standalone-runtime-example-runtime-follow-up-record.md",
  "compile_contract_artifact": "shared/contracts/runtime-to-host.md",
  "runtime_permissions_profile": "local_filesystem_only",
  "safe_output_scope": "directive-root/runtime/**",
  "sanitize_policy": "no_external_network_side_effects",
  "proposed_runtime_status": "bounded_local_reference",
  "proof_path": "runtime/03-proof/2026-03-23-standalone-runtime-example-proof-checklist.md",
  "quality_gate_profile": "bounded_local_reference_guard/v1",
  "promotion_profile_family": "bounded_local_reference",
  "proof_shape": "runtime_local_artifact_proof/v1",
  "primary_host_checker": "pnpm run check:directive-standalone-runtime-host",
  "full_text_coverage_threshold": "0",
  "evidence_binding_threshold": "100",
  "citation_error_threshold": "0",
  "observed_full_text_coverage": "0",
  "observed_evidence_binding": "100",
  "observed_citation_error_rate": "0",
  "quality_gate_result": "pass",
  "validation_state": "validated_locally",
  "quality_gate_fail_reasons": [],
  "required_gates": [
    "check:directive-standalone-runtime-host",
    "check:directive-standalone-api-host"
  ],
  "validation_result": "Standalone host can write and read the full bounded Runtime artifact lifecycle locally.",
  "rollback_plan": "Delete the generated promotion record and related local Runtime artifacts.",
  "owner": "Directive Runtime",
  "promotion_decision": "approved_for_bounded_local_reference_use"
}
